title,url,publication_date,processed_date,methodology_detailed,key_findings,technical_approach,research_design
SemRAG: Semantic Knowledge-Augmented RAG for Improved Question-Answering,https://arxiv.org/abs/2507.21110,2025-08-01T17:54:11+00:00,2025-08-03 08:06:15,"Imagine you have a huge library of books (our dataset) and you want to answer questions quickly and accurately. Traditional methods involve reading every book cover to cover, which is time-consuming and inefficient. Our goal with SemRAG is to make this process faster and more accurate by using a smarter way to find and use information.

1. **Identify the Problem**: Large Language Models (LLMs) are like librarians who need to find answers in a vast library. They struggle with specialized quest...","Our main discoveries are:

1. **Improved Accuracy**: By using semantic chunking and knowledge graphs, we significantly improve the relevance and correctness of the retrieved information. This is like our librarian finding better answers more consistently.

2. **Efficiency**: Our method is more efficient than traditional methods because it reduces computational overhead. This means our librarian can answer questions faster without needing extensive training.

3. **Scalability**: SemRAG is scal...","Let's break down the technical components of SemRAG:

1. **Sentence Embeddings**: Think of sentences as points in a multi-dimensional space. Sentence embeddings convert sentences into these points based on their meaning. We use models like BERT to create these embeddings.

2. **Cosine Similarity**: This is a measure of how close two points are in space. By calculating the cosine similarity between sentence embeddings, we can group similar sentences together. This is our semantic chunking algo...","To design our study, we followed these steps:

1. **Problem Identification**: We started by identifying the challenges in existing methods for integrating domain-specific knowledge into LLMs. These include computational expense, overfitting, and scalability issues.

2. **Hypothesis**: We hypothesized that using semantic chunking and knowledge graphs could address these challenges by making the process more efficient and accurate.

3. **Dataset Selection**: We chose the MultiHop RAG and Wikipe..."
Sumit (@reachsumit.com),https://bsky.app/profile/reachsumit.com/post/3lvcnilnqqk2d,2025-08-01T11:29:02+00:00,2025-08-03 08:06:37,"Imagine you have a large language model (LLM) that's great at understanding and generating text, but it has a limitation: it can only look at past information (causal attention) rather than both past and future (bidirectional attention). This is like trying to understand a conversation by only hearing what was said before, not what comes after. Our goal is to improve this model so it can create better text embeddings—compact representations of text that capture its meaning—without changing it...","Our main discoveries are:

1. **Improved Performance**: Causal2Vec achieves state-of-the-art performance on MTEB among models trained on publicly available retrieval datasets. This means our method creates better text embeddings than existing approaches.

2. **Efficiency Gains**: We reduce the required sequence length by up to 85% and inference time by up to 82% compared to best-performing methods. This makes our model not only effective but also efficient, saving computational resources.

Th...","Let's break down the technical implementation into simple components:

1. **BERT-style Pre-encoding**: We use a small BERT-like model to convert the input text into a single Contextual token. BERT is like a book summarizer that reads the whole book (text) and gives you a one-liner (Contextual token) that captures the essence.

2. **Token Prepending**: This Contextual token is then added to the start of the input sequence for the LLM. It's like giving the LLM a cheat sheet that summarizes what...","To design our study, we followed these steps:

1. **Problem Identification**: We recognized the limitations of decoder-only LLMs in embedding tasks due to their causal attention mechanism.

2. **Hypothesis Formulation**: We hypothesized that pre-encoding input text into a Contextual token and prepending it to the LLM's input sequence could improve embedding quality without significant overhead.

3. **Model Selection**: We chose a lightweight BERT-style model for pre-encoding to ensure efficie..."
Multiagent AI for generating chain-of-thought training data,https://www.amazon.science/blog/multiagent-ai-for-generating-chain-of-thought-training-data,2025-08-01T09:48:28+00:00,2025-08-03 08:07:08,"Imagine you're trying to teach a robot to follow a set of rules while having a conversation. The robot needs to not only respond correctly but also explain why it's responding that way—this is what we call 'chain-of-thought' reasoning. Our goal was to create high-quality training data for this robot, but hiring humans to create this data is expensive and time-consuming. So, we decided to use a team of AI agents to generate this data instead.

Our approach has three main steps:

1. **Intent De...","Our main discovery was that using a team of AI agents to generate chain-of-thought data significantly improves the performance of large language models. We found that our approach increased the average safety of the models by 29% across various benchmarks. This means the models were better at following rules and responding safely to user inputs.

We also found that our approach improved the quality of the chain-of-thought data. The generated chains were more relevant, coherent, and complete. ...","Think of our technical approach like a factory assembly line, where each station has a specific job to do.

1. **Intent Decomposition**: The first station takes the user's input and uses a large language model (LLM) to identify the user's intents. This LLM is like a sophisticated translator that understands the nuances of human language.

2. **Deliberation**: The next station involves multiple LLMs working in sequence. Each LLM reviews the chain-of-thought, makes corrections, and passes it to...","To design our study, we started with the problem of creating high-quality chain-of-thought training data. We knew that hiring humans to do this was not feasible, so we turned to AI agents.

We chose to use multiple AI agents because it mimics the collaborative process humans use to solve complex problems. Each agent has a specific role, and together, they generate and refine the chain-of-thought data.

We selected five different datasets and two different large language models to test our app..."
ARES: An Automated Evaluation Framework for Retrieval-Augmented Generation Systems,https://arxiv.org/html/2311.09476v2,2025-07-31T08:41:54+00:00,2025-08-03 08:07:28,"Imagine you're in a library looking for specific information. You have two options: either memorize every book (impractical) or use an index to quickly find what you need. Retrieval-Augmented Generation (RAG) systems are like using an index but for vast amounts of digital information. They retrieve relevant data and generate responses based on that data.

Our core problem was evaluating how well these RAG systems perform. Traditional methods, like accuracy scores, don't capture the nuances of...","Our main discoveries were like finding the best tools for a job and proving they work well together.

1. **Metric Effectiveness**: We found that our chosen metrics (like Retrieval Precision and Generation Coherence) effectively captured the strengths and weaknesses of different RAG systems. It's like having a yardstick that accurately measures what we care about.

2. **Benchmark Dataset**: Our dataset proved to be challenging and diverse enough to test RAG systems thoroughly. It's like a comp...","Think of our technical approach like building a complex machine from simple parts. Each part has a specific job, and together, they make the machine work.

1. **Retrieval Module**: This is like the machine's eyes, scanning the database to find relevant info. We used algorithms like BM25 and dense retrieval models. BM25 is like a simple search engine, while dense retrieval uses neural networks to understand the meaning of words.

2. **Generation Module**: This is the machine's brain, taking th...","Designing our study was like planning a detailed road trip. Each stop (experiment) and route (method) was chosen to answer specific questions.

1. **Comparative Analysis**: We compared different retrieval and generation models to see which combinations worked best. This is like testing different car engines and drivers to find the best pair.

2. **Ablation Studies**: We turned off certain features to see their impact. For example, we tested the system without the retrieval module to understan..."
Sumit (@reachsumit.com),https://bsky.app/profile/reachsumit.com/post/3lvaedjt25c2e,2025-07-31T08:25:20+00:00,2025-08-03 08:07:50,"Imagine you have a large, powerful machine that understands and generates human language—that's a Large Language Model (LLM). These models are great at tasks like generating text, but they struggle with summarizing information into a single, meaningful representation (embedding) for tasks like clustering or classification. Our goal was to adapt these LLMs to create better text embeddings without using too many resources.

Here's how we approached it step-by-step:

1. **Identify the Problem**:...","Our main discoveries were:

1. **Improved Embeddings**: By combining aggregation techniques, prompt engineering, and contrastive fine-tuning, we achieved state-of-the-art performance on the English clustering track of the Massive Text Embedding Benchmark (MTEB). This means our embeddings were more effective for clustering tasks.

2. **Attention Shift**: We analyzed the model's attention map and found that fine-tuning shifted the model's focus from prompt tokens to semantically relevant words....","Let's break down the technical implementation into simple components:

1. **Aggregation Techniques**: We experimented with methods like averaging token embeddings, using the embedding of the first token, or applying more complex pooling methods. Each method has its strengths—averaging might smooth out noise, while using the first token might capture the initial context.

2. **Prompt Engineering**: We designed prompts that guide the model to focus on specific tasks. For example, a prompt like ...","To design our study, we followed these steps:

1. **Problem Definition**: We clearly defined the problem as the need for better text embeddings from LLMs for tasks like clustering and classification.

2. **Hypothesis**: We hypothesized that combining aggregation techniques, prompt engineering, and contrastive fine-tuning would improve embedding quality without requiring excessive resources.

3. **Experimental Setup**: We chose the Massive Text Embedding Benchmark (MTEB) as our evaluation metr..."
HALoGEN: Fantastic LLM Hallucinations and Where to Find Them,https://arxiv.org/abs/2501.08292,2025-07-31T00:00:35+00:00,2025-08-03 08:08:17,"Imagine you're in a library with thousands of books, but some books have incorrect or made-up information. You want to find out which books are reliable and which ones aren't. This is similar to what we're doing with large language models (LLMs). LLMs generate text that sounds great, but sometimes they 'hallucinate,' meaning they produce information that's wrong or doesn't make sense.

Our goal is to measure these hallucinations efficiently. Here's how we did it step-by-step:

1. **Collect Pr...","Here's what we found:

1. **Hallucinations are Pervasive**: Even the best LLMs produce a lot of hallucinations. In some domains, up to 86% of generated atomic facts were wrong. This is like finding that even the best librarians give wrong answers most of the time.

2. **Error Types Vary**: Different LLMs make different types of errors. Some are prone to Type A errors (remembering wrong), others to Type B (learning wrong information), and some to Type C (making up information).

3. **Domain Ma...","Now, let's dive into the technical details. Imagine you're building a factory that produces checked facts.

1. **Prompt Collection**: We scraped and curated prompts from various sources. This is like gathering raw materials for our factory.

2. **Generation**: We used APIs provided by different LLM services to generate responses. Think of these APIs as workers in our factory who take in raw materials (prompts) and produce goods (responses).

3. **Atomic Fact Decomposition**: We wrote scripts ...","Here's how we set up our study:

1. **Domain Selection**: We chose nine domains to represent a wide range of tasks LLMs might face. This is like choosing different sections of the library to test our librarians.

2. **Prompt Creation**: We created prompts that are relevant, challenging, and representative of each domain. This ensures our test is fair and thorough.

3. **Model Selection**: We picked 14 LLMs, including popular ones and some less known. This is like hiring a diverse group of lib..."
Language Model Re-rankers are Fooled by Lexical Similarities,https://arxiv.org/abs/2502.17036,2025-07-29T22:40:29+00:00,2025-08-03 08:08:48,"Imagine you're trying to find the best answers to questions from a large pile of documents. Traditionally, people use simple methods like BM25, which is like a librarian who matches keywords in your question to keywords in the documents. More recently, language model (LM) re-rankers have been introduced. These are like smart assistants who not only match keywords but also understand the meaning and context of your question. They are more sophisticated but also more expensive to use.

Our rese...","Our main discoveries were:

1. **LM Re-rankers Struggle on DRUID**: Surprisingly, the LM re-rankers did not always outperform the simple BM25 baseline, especially on the DRUID dataset. This shows that even sophisticated tools can struggle in certain scenarios.

2. **Lexical Dissimilarities Cause Errors**: Using our new separation metric, we found that many of the errors made by LM re-rankers were due to lexical dissimilarities. This means the smart assistants were getting confused by word dif...","To understand our technical approach, let's break it down into simple components:

1. **Language Models as Re-rankers**: Think of a language model as a sophisticated tool that understands the context and meaning of words. When used as a re-ranker, it takes a list of potential answers and reorders them based on how well they match the question semantically.

2. **BM25 Baseline**: BM25 is a simple but effective method that ranks documents based on keyword matching. It's like a basic search engi...","Our study was designed to answer the question: Are LM re-rankers always better than simple methods like BM25? Here's how we set it up:

1. **Dataset Selection**: We chose three datasets (NQ, LitQA2, and DRUID) to represent different question-answering scenarios. This ensured our findings were not limited to one type of question.

2. **Model Selection**: We picked 6 different LM re-rankers to cover a range of approaches and see if the results were consistent across different models.

3. **Base..."
From Citations to Criticality: Predicting Legal Decision Influence in the Multilingual Swiss Jurisprudence,https://arxiv.org/abs/2410.13460,2025-07-28T12:05:48+00:00,2025-08-03 08:09:09,"Imagine you're in a hospital emergency room. Doctors need to prioritize patients based on the severity of their conditions to optimize time and resources. Similarly, court systems worldwide are overwhelmed with cases, and they need a way to prioritize which cases to handle first. This is the fundamental problem we're tackling.

Our approach starts with creating a dataset that helps us understand which legal cases are more 'critical' or influential. Here's how we did it step-by-step:

1. **Dat...","Our main discovery was that the fine-tuned models consistently outperformed the large language models. This is significant because it shows that for specialized tasks like predicting legal case influence, having specific training (fine-tuning) is more important than just having a broad range of knowledge.

It's like finding out that in our hospital, specialists perform better than general practitioners for specific tasks. This connects back to our original problem by showing that to effective...","Now, let's dive into the technical details. Think of our models as different types of doctors in our hospital analogy. Some are specialists (fine-tuned models) who have specific training, and others are general practitioners (large language models) who have a broad range of knowledge but might not be experts in any one area.

1. **Fine-Tuned Models**: These are like doctors who have gone through additional training to specialize in a particular field. We took smaller language models and fine-...","To design our study, we followed these steps:

1. **Problem Identification**: We recognized the need for effective case prioritization in court systems, similar to triage systems in hospitals.

2. **Data Requirements**: We decided we needed a large, well-labeled dataset to train and evaluate our models. This led to our algorithmic labeling approach.

3. **Model Selection**: We chose to compare fine-tuned models and large language models to see which would perform better on our specialized tas..."
Can Unconfident LLM Annotations Be Used for Confident Conclusions?,https://arxiv.org/html/2408.15204v2,2025-07-24T12:36:13+00:00,2025-08-03 08:09:31,"Imagine you're trying to solve a puzzle, but some of the pieces are a bit faded and hard to see. You're not sure if they fit perfectly, but you still want to complete the puzzle confidently. This is similar to what we're doing with Large Language Models (LLMs) and their annotations.

Our core problem is that LLMs sometimes give us 'unconfident' annotations—they're not sure about their answers. We want to see if we can still use these uncertain answers to draw confident conclusions.

Here's ho...","Our main discovery was that even when individual LLMs were unsure, combining their annotations could still give us reliable results. It's like how a team of detectives can solve a case even if each one has only partial clues.

We found that using aggregation methods significantly improved the accuracy of our final labels compared to relying on single LLM annotations. This is important because it means we can still use LLMs effectively even when they're not fully confident in their answers.

O...","Think of our technical approach like building a complex LEGO set. Each piece has a specific role, and together, they create something meaningful.

1. **LLM Annotations**: We used LLMs to label our text data. These models are like smart assistants that can understand and categorize text. They give us annotations (labels) and a confidence score for each label.

2. **Confidence Scoring**: The confidence score is like a report card grade. A high score means the LLM is very sure about its label, w...","Designing our study was like planning a treasure hunt. Each step had to be carefully thought out to lead us to the answer.

1. **Choosing LLMs**: We selected a diverse set of LLMs to ensure we had a variety of perspectives, like picking a diverse team for a project.

2. **Data Selection**: We chose a mix of easy and hard texts to annotate, ensuring our results would be robust. It's like setting up a treasure hunt with both simple and challenging clues.

3. **Confidence Thresholds**: We set di..."
Maria Antoniak (@mariaa.bsky.social),https://bsky.app/profile/mariaa.bsky.social/post/3lumkyphrok2f,2025-07-23T15:44:26+00:00,2025-08-03 08:09:55,"Imagine you're trying to teach a robot to understand something subjective, like whether a painting is beautiful. The robot can learn from examples, but it might not always get it right because beauty is in the eye of the beholder. So, you decide to put a human in the loop to help the robot learn better. This is the core idea behind our research.

Our methodology starts with a fundamental problem: How can we improve the accuracy of Large Language Models (LLMs) in tasks that are subjective, lik...","Our main discoveries were:

1. **Improved Accuracy**: We found that involving humans in the loop significantly improved the LLM's accuracy in subjective tasks. This is like the robot getting better at judging paintings with the teacher's help.

2. **Reduced Bias**: The human-in-the-loop approach also helped reduce bias in the LLM's predictions. This is important because subjective tasks can be influenced by personal biases.

3. **Efficient Learning**: The LLM was able to learn more efficientl...","Let's break down the technical implementation into simple components.

1. **Large Language Models (LLMs)**: Think of LLMs as very smart robots that can understand and generate text. They are trained on vast amounts of data to predict the next word in a sentence. This is like teaching a robot to complete your sentences.

2. **Subjective Tasks**: These are tasks where the answer depends on personal opinion. For example, deciding if a movie review is positive or negative.

3. **Human-in-the-Loop...","Our study was designed to answer the question: Can involving humans in the loop improve the performance of LLMs in subjective tasks?

Here's how we set up our experiment:

1. **Dataset Selection**: We chose a dataset that included subjective tasks, such as sentiment analysis of social media posts. This was important because we needed data that required human-like judgment.

2. **Control Group**: We had a control group where the LLM made predictions without human intervention. This was our bas..."
